title,year,usd,director,about,pic,youtube
Harry Potter y la piedra filosofal,2001,974575371,Chris Columbus,"La historia sigue a Harry Potter, un niño que al cumplir once años descubre que es un mago, por lo cual es enviado al Colegio Hogwarts de Magia y Hechicería para comenzar su entrenamiento como tal.",https://upload.wikimedia.org/wikipedia/commons/thumb/2/2b/Dragon_Challenge_19.jpg/450px-Dragon_Challenge_19.jpg,https://youtu.be/g_cY1jri6t0
Harry Potter y la cámara secreta,2002,878979634,Chris Columbus,"La historia sigue el segundo año de Harry Potter en Hogwarts, cuando el heredero de Salazar Slytherin abre la cámara secreta, liberando a un monstruo mortífero que petrifica a los alumnos del colegio. La película está protagonizada por Daniel Radcliffe como Harry Potter, junto con Rupert Grint y Emma Watson como Ron Weasley y Hermione Granger respectivamente, los mejores amigos de Harry. ",https://upload.wikimedia.org/wikipedia/commons/thumb/2/2b/Dragon_Challenge_19.jpg/450px-Dragon_Challenge_19.jpg,https://youtu.be/g_cY1jri6t0
Harry Potter y el prisionero de Azkaban,2004,796688549,Alfonso Cuarón,"Harry Potter ha pasado otro verano insatisfactorio con los Dursley. Cuando tía Marge insulta a sus padres, pierde los estribos y hace que esta se infle accidentalmente como un globo y se aleje flotando. Harto de todo, Harry huye luego de los Dursley con su equipaje. El Autobús Noctámbulo lo lleva al Caldero Chorreante, donde es perdonado por Cornelius Fudge, el ministro de Magia, por usar la magia fuera de Hogwarts. Después de reunirse con sus mejores amigos Ron Weasley y Hermione Granger, Harry descubre que Sirius Black, un convicto partidario del mago oscuro lord Voldemort, escapó de la prisión de Azkaban y tiene la intención de matarlo.",https://upload.wikimedia.org/wikipedia/commons/thumb/2/2b/Dragon_Challenge_19.jpg/450px-Dragon_Challenge_19.jpg,https://youtu.be/g_cY1jri6t0
Harry Potter y el cáliz de fuego,2005,896911078,Mike Newell,"La película inicia cuando Harry Potter (Daniel Radcliffe) empieza a ver en sus sueños al jardinero de los Riddle, Frank Bryce, quien escucha a lord Voldemort conspirando junto con Peter Pettigrew (Timothy Spall), su serpiente Nagini y otro joven en la habitación de una casa. Bryce es asesinado por Voldemort al asomarse tras ver luz proveniente de la casa. Más tarde, Harry y sus amigos visitan la final de la Copa Mundial de Quidditch, sin embargo después del partido, la celebración del equipo campeón es súbitamente interrumpida por unos sujetos enmascarados y encapuchados que empiezan a incinerar todo a su paso y a aterrorizar a los espectadores en el lugar, en su intento de escapar ",https://upload.wikimedia.org/wikipedia/commons/thumb/2/2b/Dragon_Challenge_19.jpg/450px-Dragon_Challenge_19.jpg,https://youtu.be/g_cY1jri6t0
Harry Potter y la Orden del Fénix,2007,939885929,Etc.,"Lorem ipsum dolor sit amet, consectetur adipiscing elit. Duis blandit lacus posuere, aliquam velit nec, finibus ipsum. Phasellus porttitor nisi ullamcorper enim ultricies luctus. Vestibulum malesuada tincidunt turpis, non dapibus sem vulputate sed. In lobortis id massa ut scelerisque. ",https://upload.wikimedia.org/wikipedia/commons/thumb/2/2b/Dragon_Challenge_19.jpg/450px-Dragon_Challenge_19.jpg,https://youtu.be/g_cY1jri6t0
Harry Potter y el misterio del príncipe,2009,934416487,Etc.,"Lorem ipsum dolor sit amet, consectetur adipiscing elit. Duis blandit lacus posuere, aliquam velit nec, finibus ipsum. Phasellus porttitor nisi ullamcorper enim ultricies luctus. Vestibulum malesuada tincidunt turpis, non dapibus sem vulputate sed. In lobortis id massa ut scelerisque. ",https://upload.wikimedia.org/wikipedia/commons/thumb/2/2b/Dragon_Challenge_19.jpg/450px-Dragon_Challenge_19.jpg,https://youtu.be/g_cY1jri6t0
Harry Potter y las reliquias de la Muerte: parte 1,2010,960283305,Etc.,"Lorem ipsum dolor sit amet, consectetur adipiscing elit. Duis blandit lacus posuere, aliquam velit nec, finibus ipsum. Phasellus porttitor nisi ullamcorper enim ultricies luctus. Vestibulum malesuada tincidunt turpis, non dapibus sem vulputate sed. In lobortis id massa ut scelerisque. ",https://upload.wikimedia.org/wikipedia/commons/thumb/2/2b/Dragon_Challenge_19.jpg/450px-Dragon_Challenge_19.jpg,https://youtu.be/g_cY1jri6t0
Harry Potter y las reliquias de la Muerte: parte 2,2011,1341511219,Etc.,"Lorem ipsum dolor sit amet, consectetur adipiscing elit. Duis blandit lacus posuere, aliquam velit nec, finibus ipsum. Phasellus porttitor nisi ullamcorper enim ultricies luctus. Vestibulum malesuada tincidunt turpis, non dapibus sem vulputate sed. In lobortis id massa ut scelerisque. ",https://upload.wikimedia.org/wikipedia/commons/thumb/2/2b/Dragon_Challenge_19.jpg/450px-Dragon_Challenge_19.jpg,https://youtu.be/g_cY1jri6t0